<?xml version="1.0" encoding="UTF-8"?>
<xs:schema xmlns:xs="http://www.w3.org/2001/XMLSchema">
    <xs:element name="document">
        <xs:complexType>
            <xs:sequence>
                <xs:element name="header">
                    <xs:complexType>
                        <xs:sequence>
                            <xs:element name="title" type="xs:string"/>
                            <xs:element name="author" type="xs:string"/>
                            <xs:element name="date" type="xs:date"/>
                        </xs:sequence>
                    </xs:complexType>
                </xs:element>
                <xs:element name="body">
                    <xs:complexType>
                        <xs:sequence>
                            <xs:element name="section" maxOccurs="unbounded">
                                <xs:complexType>
                                    <xs:sequence>
                                        <xs:element name="title" type="xs:string"/>
                                        <xs:element name="content" type="xs:string"/>
                                    </xs:sequence>
                                    <xs:attribute name="id" type="xs:ID" use="required"/>
                                </xs:complexType>
                            </xs:element>
                        </xs:sequence>
                    </xs:complexType>
                </xs:element>
            </xs:sequence>
            <xs:attribute name="version" type="xs:decimal" use="required"/>
        </xs:complexType>
    </xs:element>
</xs:schema>