<?xml version="1.0" encoding="UTF-8"?>
<document xmlns:xsi="http://www.w3.org/2001/XMLSchema-instance"
          xsi:noNamespaceSchemaLocation="../schemas/local/complex.xsd"
          version="1.0">
    <header>
        <title>Test Document</title>
        <author>Test Author</author>
        <date>2024-01-01</date>
    </header>
    <body>
        <section id="intro">
            <title>Introduction</title>
            <content>This is the introduction section.</content>
        </section>
        <section id="main">
            <title>Main Content</title>
            <content>This is the main content section.</content>
        </section>
    </body>
</document>